id,name,host_id,host_identity_verified,host_name,neighbourhood_group,neighbourhood,lat,long,country,country_code,instant_bookable,cancellation_policy,room_type,construction_year,price,service_fee,minimum_nights,number_of_reviews,last_review,reviews_per_month,review_rate_number,calculated_host_listings_count,availability_365,house_rules,license
1251528,N/A,44376708665,unconfirmed,Aldus,Brooklyn,Bedford-Stuyvesant,40.67963,-73.93908,United States,US,TRUE,strict,Private room,2014,0.0,0.0,1,64,2019-07-01,0.68,1,3,365,N/A,N/A
1252080,Red Room for two in Brownstone for $1355/mo,43465301578,verified,Gianna,Brooklyn,Bedford-Stuyvesant,40.6798,-73.93908,United States,US,TRUE,moderate,Private room,2017,0.0,0.0,1,39,2019-06-24,0.41,5,3,193,N/A,N/A
1252633,"Chelsea living, 2BR best location",42275596201,unconfirmed,Kirsten,Manhattan,Chelsea,40.74346,-73.99882,United States,US,FALSE,flexible,Private room,2004,0.0,0.0,2,37,2019-07-03,1.79,2,1,362,"Please remember that this is a residential building. The building rules, apartment occupancy restrictions and the year-round tenants must be respected.",N/A
1253185,LOCATION LOCATION LOCATION UWS 60's,61131560985,verified,Freddie,Manhattan,Upper West Side,40.77724,-73.98109,United States,US,TRUE,flexible,Entire home/apt,2021,0.0,0.0,3,10,2019-01-01,0.12,5,1,100,"In the kitchen the primary thing would be to wash your own dishes and clean up after yourself. We don't usually use shoes in the house, we can provide you with slippers or you might want to bring some. Its not a problem if you have to use orthopedic shoes. The bathroom is clean and we want folks to hang up your towels,either in your room or in the bathroom, and not leave the floor wet. We are not a loud house at night. Alcohol is fine so long as you aren't bent on getting drunk. And please no smoking inside, we have plenty of space outdoors for that. If you are here by yourselves for more than 3-4 days we may ask you to water the house plants. We ask that you recycle all pertinent trash and compost your food scraps, if you're not familiar with that we'll be happy to show you our system. No outdoor fires allowed if we are not present. Check in time is best at 3 PM and check out is at noon.",N/A
1253737,In the heart of East Village,65849605461,verified,Adam,Manhattan,East Village,40.72972,-73.97995,United States,US,TRUE,strict,Entire home/apt,2020,0.0,0.0,2,103,2019-06-24,1.08,2,1,248,N/A,N/A
1254289,Sunny 15min to Manhattan LADY only,90186098837,verified,Honey,Queens,Sunnyside,40.74102,-73.91681,United States,US,FALSE,moderate,Private room,2004,0.0,0.0,40,41,2019-06-01,0.43,2,3,365,#NAME?,N/A
1254842,Surfer room 15mins to downtown NYC!,83903389887,verified,Eleanor,Brooklyn,Williamsburg,40.71309,-73.94128,United States,US,FALSE,flexible,Private room,2018,0.0,0.0,6,3,2014-08-31,0.03,5,1,231,No smoking,N/A
1255394,Manhattan Penthouse-Max.12 guests,64685280889,unconfirmed,Lydia,Manhattan,Harlem,40.83096,-73.94633,United States,US,TRUE,strict,Entire home/apt,2010,0.0,0.0,3,227,2019-06-26,2.33,3,1,365,N/A,N/A
1255946,Prime Williamsburg 3 BR with Deck,47032262131,unconfirmed,Sydney,Brooklyn,Williamsburg,40.71323,-73.95745,United States,US,FALSE,moderate,Entire home/apt,N/A,0.0,0.0,5,37,2018-12-27,0.79,5,1,297,"1. Please clean-up after yourself in the kitchen and keep the living room tidy. 2. Since we go to work/school, please avoid loud noises after 11pm during weekdays.  3. Important: To ensure everyone's safety, guest will be charged the full fee of changing the door knob if key is lost/stolen",N/A
1256499,Beautiful Brooklyn Oasis,64691515953,verified,Julia,Brooklyn,Crown Heights,40.67212,-73.9506,United States,US,FALSE,moderate,Entire home/apt,N/A,0.0,0.0,2,29,2019-06-28,0.35,2,1,0,N/A,N/A
1257051,Blue Room in Awesome Artist's Apartment!,62654081415,unconfirmed,Adam,Brooklyn,Williamsburg,40.71023,-73.96665,United States,US,TRUE,strict,Private room,N/A,0.0,0.0,3,205,2017-12-31,2.31,5,3,199,"My roommates and I take a lot of pride in keeping the house clean and tidy, particularly the common areas. If you plan on staying for more than a couple weeks, all the cleaning supplies under the kitchen sink and a vacuum are at your disposal :) No pets and no smoking please.",N/A
1257603,Cool & Spacious Harlem Artist Flat,21976510866,N/A,Rafael,Manhattan,Harlem,40.80523,-73.95139,United States,US,FALSE,flexible,Entire home/apt,N/A,0.0,0.0,5,42,2019-06-03,0.44,5,2,10,#NAME?,N/A
1258156,☆ STUDIO East Village ☆ Own bath! ☆ Sleeps 4 ☆,87134189711,N/A,Alan,N/A,East Village,40.72636,-73.98917,United States,US,TRUE,strict,Entire home/apt,N/A,0.0,0.0,2,280,2019-07-05,2.92,1,3,94,N/A,N/A
1258708,Greenpoint Loft / Le Chez Andrea,60141836267,N/A,Melanie,Brooklyn,Greenpoint,40.72185,-73.93956,United States,US,TRUE,strict,Private room,N/A,0.0,0.0,4,86,2019-06-08,0.89,1,3,228,N/A,N/A
1259260,"*SoHo: Clean, Safe, Private, Peaceful Bedroom (A)*",58284792631,N/A,Stella,Manhattan,SoHo,40.72351,-73.99683,United States,US,TRUE,strict,Private room,2020,0.0,0.0,2,54,2019-06-16,0.56,1,1,70,"Please be mindful that I live in the same building. If you break these rules, I will probably know about it. I have had the rare guests that caused problems, so I do take the rules quite seriously.   All guests must be OVER 21 years old to stay.  No parties and/or visitors. Do not bring your own guests or visitors over. Do not show up with your friends/family that are in the area. The only people allowed in the listing are the guests (2 adults max, including yourself) that are included in your reservation. You can not bring anyone else over, even if it's just for a few minutes. No exceptions, so please don't ask. I'm picky about this rule because I have had college kids try to book this place for parties and gatherings.  Please turn off the AC and lights when you go outside. Please be respectful of the neighbors and the listing. This isn't a place to be rowdy. No smoking anywhere. Please no e-cig/vaping either. No candles, incense or other open flames Please do not move or rearrange th",N/A
1259812,Amazing Brownstone in Best Brooklyn,52707584632,N/A,Ryan,Brooklyn,Carroll Gardens,40.6809,-73.99233,United States,US,FALSE,strict,Entire home/apt,2013,0.0,0.0,7,7,2018-08-29,0.07,5,1,315,N/A,N/A
1260365,Couldn't Be Closer To Columbia Uni2,83966982530,N/A,Paul,Manhattan,Morningside Heights,40.80525,-73.95916,United States,US,FALSE,moderate,Private room,2005,0.0,0.0,5,57,2019-01-01,0.59,5,2,84,N/A,N/A
1260917,Lady only Curtain-divided room,78440704783,N/A,Gianna,Queens,Sunnyside,40.74,-73.91901,United States,US,TRUE,strict,Private room,2008,0.0,0.0,44,31,2019-05-01,0.32,5,3,75,"- I work at home and prefer to rent to folks who are visiting Boston for business and professional reasons.  Most of my guests are here to work in the Longwood Medical Area.  I often rent to fourth-year medical students doing rotations at HMS, and to physicians and post-docs affiliated with other institutions in the LMA. - I have a dog and two cats, so please take care and don't leave the front door standing open. -Please, no guests.  There are lots of pubs in the neighborhood if you want to meet friends.",N/A
1261469,Nice Manhattan Apt Near Central Park and Subway,40890787484,N/A,Heather,Manhattan,Upper West Side,40.80006,-73.96049,United States,US,TRUE,moderate,Entire home/apt,2004,0.0,0.0,0,188,2018-08-23,1.94,3,1,365,N/A,N/A
1262022,LG Private Room/Family Friendly,45447948206,verified,Alexander,Brooklyn,Bushwick,40.70283,-73.92131,United States,US,TRUE,moderate,Private room,2004,0.0,0.0,0,480,2019-07-07,6.7,2,1,319,N/A,N/A
1262574,Spacious Quiet rm - 20mins to Midtown,60243935879,unconfirmed,Sarah,Manhattan,Washington Heights,40.84468,-73.94303,United States,US,TRUE,strict,Private room,2016,0.0,0.0,398,34,2019-06-15,0.35,1,1,182,"This place is about enjoying good times and the views, great place to take it all in. This is not a good set-up for children ages 1-13.",N/A
1263126,"3 BR, Beautiful Brooklyn Duplex",91037237183,verified,Ashton,Brooklyn,Carroll Gardens,40.68252,-73.99619,United States,US,FALSE,flexible,Entire home/apt,2016,0.0,0.0,0,6,2015-08-08,0.06,3,1,164,Shoes off Clean After yourself Turn Lights and your room AC off when leaving the apartment Clean the stove with the specific cleaner when used (Ask the host about it),N/A
1263679,Spacious modern studio apartment in Manhattan,25763359778,unconfirmed,Sarah,Manhattan,Chelsea,40.74342,-73.99483,United States,US,TRUE,flexible,Entire home/apt,2008,0.0,0.0,0,3,2018-05-13,0.04,5,2,266,#NAME?,N/A
1264231,Gorgeous Duplex + Garden,19341139444,unconfirmed,Richard,Brooklyn,Park Slope,40.67853,-73.98089,United States,US,FALSE,flexible,Entire home/apt,2008,0.0,0.0,0,2,2014-08-31,0.03,4,1,0,"* Check out: 10am * We made an effort to keep things organized. Please help us to maintain the house as beautiful and clean as possible.  * Please ask before bringing visitors, and sorry I can only allow the number of guest on the reservation to stay overnight.  * I also ask that shoes not be worn in the house to keep the wood floors clean, and that you only eat in the dining room area.",N/A
1264783,CBG# 4Tiny room w/ huge window/AC,87560538920,unconfirmed,Maya,Brooklyn,Park Slope,40.6788,-73.97643,United States,US,TRUE,moderate,Private room,2020,0.0,0.0,0,20,2018-08-24,0.21,2,6,0,"Each of us is working and/or going to school at the moment, so weekday guests are expected to respect a quiet period from 12am to 8am. On weekends, we almost always go out and encourage you to do the same! You're welcome to make noise in your room at a reasonable level, but we prefer that you wrap it up no later than 3am at the absolute latest on weekends.",N/A
1265335,Charming upper west side apartment,89878315253,unconfirmed,Alen,Manhattan,Upper West Side,40.77886,-73.98042,United States,US,TRUE,strict,Entire home/apt,2022,0.0,0.0,-2,129,2019-06-07,1.33,2,1,365,"Please remember that this is a residential building.  All building rules, Hotel occupancy restrictions, and year-round tenants must be respected.",N/A
1265888,Light-filled East Village Delight,11984398378,unconfirmed,Dainton,Manhattan,East Village,40.72578,-73.97879,United States,US,FALSE,moderate,Entire home/apt,2021,0.0,0.0,3,147,2019-06-30,1.6,5,1,253,N/A,N/A
1266440,"Sunny, quiet, legal homelike suite-Pk Slope South",69029062217,unconfirmed,Jessica,Brooklyn,South Slope,40.66085,-73.98537,United States,US,FALSE,moderate,Entire home/apt,2017,0.0,0.0,28,101,2019-07-01,1.06,4,1,53,"Please remember that this is a residential building.  All building rules, hotel occupancy restrictions, and year-round tenants must be respected.",N/A
1266992,Spacious Duplex in Brownstone!,15494932228,verified,Lana,Manhattan,East Harlem,40.80113,-73.94503,United States,US,FALSE,moderate,Entire home/apt,2006,0.0,0.0,2,11,2016-01-02,0.12,4,2,191,N/A,N/A
1267545,Lovely Vintage Haven—Heart of UWS,1640832963,verified,Valeria,Manhattan,Upper West Side,40.78569,-73.97581,United States,US,FALSE,strict,Entire home/apt,2010,0.0,0.0,65,11,2013-10-15,0.12,4,1,365,N/A,N/A
1268097,Modern Space in Charming Pre-war,13746585241,verified,Adelaide,Manhattan,Harlem,40.82411,-73.94934,United States,US,FALSE,flexible,Private room,N/A,0.0,0.0,2,41,2040-06-16,0.43,3,2,47,N/A,N/A
1268649,Warehouse Loft with Garden view,98531770068,unconfirmed,Olivia,Brooklyn,Bedford-Stuyvesant,40.68131,-73.95332,United States,US,FALSE,flexible,Entire home/apt,N/A,0.0,0.0,2,87,2017-04-18,1.09,2,1,71,"My home is your home. Please enjoy this space as much as I do. But also, please respect it. Don't rough house or party excessively, there are plenty of other places to do that. Please smoke cigarettes outside. No pets, sorry, I'm allergic!",N/A
1269202,Affordable & Cozy,4478636950,unconfirmed,Evelyn,Bronx,University Heights,40.85811,-73.90675,United States,US,FALSE,moderate,Private room,N/A,0.0,0.0,4,117,2019-05-21,1.21,0,1,98,No smoking please.,N/A
1269754,Creative Vintage Loft in S. Williamsburg,51790975679,unconfirmed,Alan,Brooklyn,Williamsburg,40.70667,-73.96524,United States,US,TRUE,strict,Entire home/apt,N/A,0.0,0.0,2,86,2019-05-16,0.89,0,2,365,Please no loud music or smoking in the courtyard. You can smoke in the house by the window if you need to. Pets are allowed if you have references in your profile.,N/A
1270306,Very close to Downtown Awesome Private Apartment,7445813909,unconfirmed,Antony,Brooklyn,Gravesend,40.60452,-73.97103,United States,US,TRUE,flexible,Entire home/apt,2021,0.0,0.0,7,0,,0.0,0,2,159,N/A,N/A
1270858,The Happy home!,91709093046,verified,Eddy,N/A,East Harlem,40.7932,-73.94007,United States,US,FALSE,strict,Entire home/apt,2007,0.0,0.0,2,15,2016-02-15,0.16,0,1,326,"Please remember that this is a residential building. All building rules, hotel occupancy restrictions, and year-round tenants must be respected.",N/A
1271411,"Fort Greene, Brooklyn: Front Bedroom",88429217001,verified,Maria,Brooklyn,Fort Greene,40.68768,-73.97611,United States,US,FALSE,moderate,Private room,2017,0.0,0.0,2,35,2019-07-02,0.55,0,2,365,"Generally, we prefer that guests treat our home as a friends house, rather than a hotel. - Quiet hours are 11pm to 7am - Feel free to partake in our electric tea kettle, K-Cup machine and espresso machine -Food left on the kitchen island is for guests to enjoy! - Feel free to use the kitchen, but kindly wash your dishes  - No pets - There is usually somebody home if you have a question or something that needs addressing, just give us a knock!   - Please let us know if there's anything we can do to improve your stay with us :)",N/A
1271963,Gorgeous 1 bdrm in huge duplex!,80917711958,verified,Julian,Manhattan,Harlem,40.80224,-73.94558,United States,US,TRUE,moderate,Private room,2016,0.0,0.0,2,17,2015-10-01,0.18,3,2,0,N/A,N/A
1272515,"Sunny, cozy room in Lower East Side",84473709196,verified,Lucia,Manhattan,Lower East Side,40.71473,-73.98842,United States,US,FALSE,flexible,Private room,2016,0.0,0.0,3,3,2016-02-15,0.04,4,2,9,N/A,N/A
1273068,Large Quiet Bedroom Near Columbia U,95738430033,verified,Rebecca,N/A,Harlem,40.80518,-73.95359,United States,US,FALSE,strict,Private room,2016,0.0,0.0,5,43,2018-01-03,0.47,3,2,147,N/A,N/A
1273620,Cozy Pre-War Harlem Apartment,88013998883,verified,Daniel,Manhattan,Harlem,40.80827,-73.95329,United States,US,TRUE,flexible,Shared room,2019,0.0,0.0,3,168,2019-07-06,4.6,5,1,345,N/A,N/A
1274172,spacious studio,60622441965,verified,Edwin,Brooklyn,Greenpoint,40.72901,-73.95812,United States,US,TRUE,strict,Private room,2012,0.0,0.0,3,241,2019-06-24,2.49,4,1,186,N/A,N/A
1274725,"Elegant 2-BR duplex, Union Square",44367748174,verified,Albert,Manhattan,Gramercy,40.73476,-73.98452,United States,US,FALSE,flexible,Entire home/apt,2016,0.0,0.0,2,105,2019-06-23,1.13,3,1,248,"Please remember that this is a residential building. The building rules, apartment occupancy restrictions and the year-round tenants must be respected.",N/A
1275277,Cozy private family home in Bushwick,84893152286,unconfirmed,Adison,Brooklyn,Bushwick,40.69055,-73.92357,United States,US,TRUE,strict,Entire home/apt,2011,0.0,0.0,2,11,2018-10-28,0.46,2,1,187,N/A,N/A
1275829,Luxury 2Bed/2.5Bath Central Park View,96286267716,verified,Walter,Manhattan,Upper West Side,40.7735,-73.98697,United States,US,TRUE,moderate,Entire home/apt,2003,0.0,0.0,30,30,2018-05-05,0.33,4,11,365,N/A,N/A
1276381,Cosy Sunny 1brm in Prospect Heights,17180989319,verified,Ted,Brooklyn,Crown Heights,40.67505,-73.95969,United States,US,FALSE,moderate,Entire home/apt,2009,0.0,0.0,3,31,2018-10-23,0.32,1,1,70,N/A,N/A
1276934,East Village bedroom w rooftop,17802908936,verified,Kate,Manhattan,East Village,40.72974,-73.98201,United States,US,FALSE,moderate,Private room,2014,0.0,0.0,4,49,2019-05-07,0.51,1,2,268,N/A,N/A
1277486,Williamsburg Home Away From Home!,58444192906,unconfirmed,Ned,Brooklyn,Williamsburg,40.70925,-73.95425,United States,US,FALSE,flexible,Entire home/apt,2015,0.0,0.0,4,23,2019-04-13,0.24,3,1,209,"- Check-in time is 1PM - 12PM. - Earlier than 1pm check-in may be an option, will accommodate when possible.  -When you move in, I will clean the room for you.  - Quiet after 11pm - Please treat the home as you would your own, and treat your hosts as you would like to be treated! - Please let me know If you have any question, I will try my best to help you. - Please try to keep quiet It is okay that you have a child who is more than 7 years to live in, but the price should be discussed.",N/A
1278038,Brand New Beautiful Duplex Apartment with Garden,26436280092,verified,Chelsea,Brooklyn,Greenpoint,40.72315,-73.95226,United States,US,TRUE,strict,Entire home/apt,2020,0.0,0.0,2,20,2019-06-24,0.21,5,2,247,"Generally, we prefer that guests treat our home as a friends house, rather than a hotel. - Food/snacks left on the island are free to eat - Feel free to cook your own food, but kindly wash and put away your dishes after - Feel free to use the Keurig - No pets - Be respectful of the items in the apartment, and leave the space reasonably clean.",N/A
1278591,"PRIME, Luxury, Spacious 2 Bedroom Apt in Chelsea",29253854739,verified,Cherry,Manhattan,Chelsea,40.73939,-73.99612,United States,US,FALSE,strict,Entire home/apt,2022,0.0,0.0,10,18,2019-06-24,0.9,5,1,0,N/A,N/A
1279143,SPACIOUS ALCOVE STUDIO/ JUNIOR ONE,46404652822,unconfirmed,Honey,Manhattan,Kips Bay,40.74112,-73.97686,United States,US,TRUE,flexible,Entire home/apt,2005,0.0,0.0,6,90,2019-06-23,0.95,3,1,0,N/A,N/A
1279695,High-end doorman bldg in the LES,58667832089,verified,Annabella,Manhattan,Lower East Side,40.72019,-73.98217,United States,US,TRUE,moderate,Private room,2011,0.0,0.0,2,99,2019-06-27,1.04,5,1,0,N/A,N/A
1280248,Spring & Mulberry 2 Bedroom Apartment,70418022717,verified,Lucia,Manhattan,Nolita,40.72133,-73.99666,United States,US,TRUE,strict,Entire home/apt,2006,0.0,0.0,1,6,2019-06-28,0.06,5,3,0,N/A,N/A
1280800,Ultra Modern NYC Garden Apartment,4056781803,verified,Steven,Queens,Astoria,40.75744,-73.92163,United States,US,TRUE,moderate,Entire home/apt,2015,0.0,0.0,30,21,2018-12-01,0.22,5,8,0,"You're our guest, so please make yourself at home. Be clean! Rachel and I keep a tight ship around the apartment and we'd like our guests to be as clean as us. =) Speak up! Let us know if you need anything.  Party down (if you let us know).  We aren't huge partiers, but if you like to listen to music or watch loud TV, let us know ahead of time.  This is important.",N/A
1281352,Modern Garden Apartment in NYC,84486431830,verified,Adelaide,Queens,Astoria,40.75695,-73.9202,United States,US,FALSE,strict,Entire home/apt,2013,0.0,0.0,30,24,2019-04-04,0.26,5,8,0,N/A,N/A
1281904,Gorgeous Entire Manhattan Townhouse,26719503238,verified,James,Manhattan,Harlem,40.8296,-73.94651,United States,US,FALSE,flexible,Entire home/apt,2014,0.0,0.0,2,111,2019-06-02,1.17,3,1,0,N/A,N/A
1282457,Cozy studio Apartment in Upper East,30563131860,unconfirmed,Kimberly,Manhattan,East Harlem,40.79056,-73.9468,United States,US,FALSE,strict,Entire home/apt,2014,0.0,0.0,2,86,2019-06-20,0.91,1,1,0,"• Check-in time is 3PM. This is a non-smoking apartment  No pets No loud music No Party 21+ guests only, unless accompanied by an adult who is 21+",N/A
1283009,Historic classic central cozy Village clean NYU,75745621560,unconfirmed,Maximilian,Manhattan,West Village,40.73631,-73.99977,United States,US,FALSE,moderate,Entire home/apt,2020,0.0,0.0,15,66,2019-04-29,0.69,5,2,0,Treat our apartment as if it were your own =). 1. No pets please.  2. Smoking outside or on the deck only.  3. Please treat the common amenities with respect.  4. We expect you to clean up after yourself.,N/A
1283561,A PRIVATE FLAT / APARTMENT- $SPECIAL$,25554233693,unconfirmed,Alford,Bronx,Allerton,40.86466,-73.85709,United States,US,FALSE,strict,Entire home/apt,2008,0.0,0.0,2,271,2019-06-20,2.84,1,2,0,"Please remember that this is a residential building. The building rules, apartment occupancy restrictions and the year-round tenants must be respected.  Parties, pets and smoking are not allowed under any circumstances and incur significant fees.",N/A
1284114,Williamsburg bedroom by Bedford Ave,45711651598,unconfirmed,Lana,Brooklyn,Williamsburg,40.71312,-73.96199,United States,US,TRUE,flexible,Private room,2008,0.0,0.0,2,227,2019-06-18,2.4,5,1,19,No Smoking.,N/A
1284666,Clean and bright with a comfortable atmosphere,50368029517,unconfirmed,Henry,Brooklyn,Williamsburg,40.71297,-73.94336,United States,US,TRUE,flexible,Private room,2005,0.0,0.0,4,80,2019-07-06,1.55,3,1,88,"Please remember that this is a residential building. The building rules, apartment occupancy restrictions and the year-round tenants must be respected.  Parties, pets and smoking are not allowed under any circumstances and incur significant fees. ",N/A
1285218,WEST VILLAGE LRG CLEAN SUNNY PRIVATE BDRM,55683633907,unconfirmed,Reid,Manhattan,West Village,40.73712,-74.00166,United States,US,TRUE,moderate,Private room,2004,0.0,0.0,30,5,2018-12-03,0.07,5,1,62,N/A,N/A
1285771,Historic Brooklyn Studio Apartment,64185966058,unconfirmed,Miley,Brooklyn,Bedford-Stuyvesant,40.69242,-73.95097,United States,US,FALSE,strict,Entire home/apt,2012,0.0,0.0,2,187,2019-06-10,1.97,3,2,365,Please be honest and respectful. That's it!,N/A
1286323,Comfort at Crossroads of Downtown,82992556236,verified,Kevin,Manhattan,Chelsea,40.73862,-73.99758,N/A,N/A,N/A,N/A,Entire home/apt,2018,0.0,0.0,1,2,2015-08-28,0.02,2,1,256,"We expect our guests to be honest, to treat our property with respect, and to leave the apartment as clean (relatively) as when they arrived.",N/A
1286875,"""The Oasis"" on Bedford Williamsburg",30603782652,unconfirmed,Lucas,Brooklyn,N/A,40.7158,-73.95803,N/A,N/A,N/A,N/A,Entire home/apt,2005,0.0,0.0,6,1,2016-01-01,0.02,5,1,266,1. No parties. 2. Respect the neighbors.  Noise level needs to stay low. 3. Keep feet on the porch when outside. 4. Clean any dishes you use. Not a good set up for children (0 - 13).,N/A
1287427,"Large, sunny garden apartment.",74260924259,unconfirmed,Spike,Brooklyn,Prospect Heights,40.68262,-73.97299,N/A,N/A,N/A,N/A,Entire home/apt,2019,0.0,0.0,3,67,2018-10-20,0.7,1,1,18,"1. Guests should be considerate of the other roommates in the apartment. The other roommates are all great/friendly/easy-going people, so there shouldn't be an issue! 2. I expect guests to clean up after themselves, especially in the kitchen and bathroom since those are communal areas.  3. I would prefer if guests did not invite their own guests or throw any events without the consent of the other roommates 4. Obviously, I would like the guest to be respectful of the furniture and make sure they do not damage/break any property that is not theirs 5. The guest cannot be a smoker or expect to do any illicit drugs while staying the apartment",N/A
1287980,UNION SQUARE/ E. VILL 1BR BEAUTIFUL,65125319788,verified,Tess,Manhattan,East Village,40.73217,-73.98801,N/A,N/A,N/A,N/A,Entire home/apt,2003,0.0,0.0,1,63,2018-01-12,0.68,1,1,349,N/A,N/A
1288532,Hell's Kitchen Funky 80's Hideaway!,48327323941,unconfirmed,Sydney,Manhattan,Hell's Kitchen,40.76311,-73.99388,N/A,N/A,N/A,N/A,Private room,2007,0.0,0.0,1,89,2019-07-01,1.0,1,1,365,"Please remember that this is a residential building. The building rules, apartment occupancy restrictions and the year-round tenants must be respected.  Parties, pets and smoking are not allowed under any circumstances and incur significant fees.",N/A
1289084,Room in Chic Modern High Line Luxury- New!,20510598547,verified,Adrian,Manhattan,Chelsea,40.74695,-74.00454,United States,US,FALSE,moderate,Private room,2011,0.0,0.0,4,1,2014-04-20,0.02,3,1,365,"HELP US AVOID MAKE-UP STAINS:  Dear Guest, For make-up removal, if needed, kindly use the small face towels, and not our large white towels. Thanks for being considerate!",N/A
1289637,Family & Friends in New York City,9750353852,unconfirmed,Emma,Brooklyn,East New York,40.67497,-73.87305,United States,US,TRUE,moderate,Entire home/apt,2011,0.0,0.0,3,177,2019-06-29,1.86,2,1,145,"Overall please treat the apartment as you would you own home, Keeping it as clean and tidy as you found it.  Please clean up before checking out. Any major clean-up service required may be deducted from the deposit.  No Loud / Large Parties .  Please include the number of people who will be staying before you reserve this apartment. No extra guests other than the maximum 3 allowed who booked  All smoking should be done outside, as this is a smoke free enviroment.",N/A
1290189,Spacious & Comfy BK Brownstone,57100781847,verified,Leonardo,Brooklyn,Crown Heights,40.66788,-73.94813,United States,US,FALSE,flexible,Entire home/apt,2010,0.0,0.0,4,90,2019-06-30,0.94,3,1,45,No Drugs Respect the Neighbourhood No excess Noise Smoking allowed Drinking allowed Pets allowed Keep the house clean Respect your roommates Wash your own utensils if used,N/A
1290741,Large Luxury Upper East Side Studio,11373673042,verified,Cadie,Manhattan,Upper East Side,40.76684,-73.95944,United States,US,TRUE,flexible,Entire home/apt,2014,0.0,0.0,7,39,2019-07-07,0.41,2,1,365,"HELP US AVOID MAKE-UP STAINS: Dear Guest, For make-up removal, if needed, kindly use the small face towels, and not our large white towels. Thanks for being considerate!",N/A
1291294,Chateau Style Brooklyn Loft for Singles or Couples,2631536622,verified,Carlos,Brooklyn,Bedford-Stuyvesant,40.68967,-73.95445,United States,US,FALSE,moderate,Entire home/apt,2022,0.0,0.0,-3,42,2019-05-18,0.44,5,1,292,BUILDING IS RESIDENTIAL. DOCTORS AND NURSES WHO WORK LONG HOURS ARE THE PRIMARY TENANTS OF THIS BUILDING SO RESPECTFUL NOISE LEVELS DURING 10PM-7AM ARE A MUST.,N/A
