id,name,host_id,host_identity_verified,host_name,neighbourhood_group,neighbourhood,lat,long,country,country_code,instant_bookable,cancellation_policy,room_type,construction_year,price,service_fee,minimum_nights,number_of_reviews,last_review,reviews_per_month,review_rate_number,calculated_host_listings_count,availability_365,house_rules,license
1001254,Clean & quiet apt home by the park,80014485718,unconfirmed,Madaline,Brooklyn,Kensington,40.64749,-73.97237,United States,US,FALSE,strict,Private room,2020,0.0,0.0,10,9,2021-10-19,0.21,4,6,286,Clean up and treat the home the way you'd like your home to be treated.  No smoking.,N/A
1002102,Skylit Midtown Castle,52335172823,verified,Jenna,Manhattan,Midtown,40.75362,-73.98377,United States,US,FALSE,moderate,Entire home/apt,2007,0.0,0.0,30,45,2022-05-21,0.38,4,2,228,Pet friendly but please confirm with me if the pet you are planning on bringing with you is OK. I have a cute and quiet mixed chihuahua. I could accept more guests (for an extra fee) but this also needs to be confirmed beforehand. Also friends traveling together could sleep in separate beds for an extra fee (the second bed is either a sofa bed or inflatable bed). Smoking is only allowed on the porch.,N/A
1002403,THE VILLAGE OF HARLEM....NEW YORK !,78829239556,N/A,Elise,Manhattan,Harlem,40.80902,-73.9419,United States,US,TRUE,flexible,Private room,2005,0.0,0.0,3,0,,0.0,5,1,352,"I encourage you to use my kitchen, cooking and laundry facilities. There is no additional charge to use the washer/dryer in the basement.  No smoking, inside or outside. Come home as late as you want.  If you come home stumbling drunk, it's OK the first time. If you do it again, and you wake up me or the neighbors downstairs, we will be annoyed.  (Just so you know . . . )",N/A
1002755,N/A,85098326012,unconfirmed,Garry,Brooklyn,Clinton Hill,40.68514,-73.95976,United States,US,TRUE,moderate,Entire home/apt,2005,0.0,0.0,30,270,2019-07-05,4.64,4,1,322,N/A,N/A
1003689,Entire Apt: Spacious Studio/Loft by central park,92037596077,verified,Lyndon,Manhattan,East Harlem,40.79851,-73.94399,United States,US,FALSE,moderate,Entire home/apt,2009,0.0,0.0,10,9,2018-11-19,0.1,3,1,289,"Please no smoking in the house, porch or on the property (you can go to the nearby corner).  Reasonable quiet after 10:30 pm.  Please remove shoes in the house.",N/A
1004098,Large Cozy 1 BR Apartment In Midtown East,45498551794,verified,Michelle,Manhattan,Murray Hill,40.74767,-73.975,United States,US,TRUE,flexible,Entire home/apt,2013,0.0,0.0,3,74,2019-06-22,0.59,3,1,365,"No smoking, please, and no drugs.",N/A
1004650,BlissArtsSpace!,61300605564,N/A,Alberta,Brooklyn,Bedford-Stuyvesant,40.68688,-73.95596,United States,US,FALSE,moderate,Private room,2015,0.0,0.0,45,49,2017-10-05,0.4,5,1,224,Please no shoes in the house so bring slippers or extra socks to keep your feet warm- especially in winter! No smoking either inside or outside. Please be considerate of neighbors from 10pm-7am in terms of noise. Please take out any trash and leave in the large blue garbage bin at the end of the driveway when you leave.,N/A
1005202,BlissArtsSpace!,90821839709,unconfirmed,Emma,Brooklyn,Bedford-Stuyvesant,40.68688,-73.95596,United States,US,FALSE,moderate,Private room,2009,0.0,0.0,45,49,2017-10-05,0.4,5,1,219,"House Guidelines for our BnB We are delighted to welcome you.  Check in Sun – Thurs by 8PM and Fri, Sat by 9pm. Please bear in mind that this is not a hotel but our home and we are opening it to you.  We will do our utmost to make your stay enjoyable and fun.  We ask that you take care to respect our home and its appearance.  Thank you.  Marilyn and Alan 1.ROOMS - The bedroom is yours for the duration of your stay.  Be sure to let us know if you need something.  Please keep it neat and tidy and take advantage of the closet and bureau for your belongings.  We do ask that you turn off lights, air conditioner, fan, etc. when you are not in the room. Thank you. 2.LIGHTS – Please, too, remember to turn off lights on the stairway when returning.   3.KEYS - 2 house keys are provided - Replacement cost is $15 each 4.PARKING – Parking is available on street at all times.   5.SHOES – When the weather is inclement please remove shoes.   6.TOILETRIES - If you need them we can provide basic toiletr",N/A
1005754,Large Furnished Room Near B'way,79384379533,verified,Evelyn,Manhattan,Hell's Kitchen,40.76489,-73.98493,United States,US,TRUE,strict,Private room,2005,0.0,0.0,2,430,2019-06-24,3.47,3,1,180,"- Please clean up after yourself when using the kitchen. - When using the bathroom, please be careful to minimize the amount of water on the floor when showering and using the sink. - Please make sure to remove any strands of hair from the sink and floors with a tissue or paper towel. - Be respectful of the noise levels after 11pm.  - Please be quiet coming in late or leaving early. - No Smoking  - No Pets - No overnight guests - For safety reasons, please make sure to shut and lock the windows and front door when you leave. *** Note: cancellations are subject to fees that are non refundable ***",N/A
1006307,Cozy Clean Guest Room - Family Apt,75527839483,unconfirmed,Carl,Manhattan,Upper West Side,40.80178,-73.96723,United States,US,FALSE,strict,Private room,2015,0.0,0.0,2,118,2017-07-21,0.99,5,1,365,"NO SMOKING OR PETS ANYWHERE ON THE PROPERTY 1. Be respectful of the other tenants 2. If you use the grill, be sure to turn off the gas 3. Notify the owner of any discrepancies or things not functioning properly immediately 4. Please treat carpet stains promptly (or notify the owner) 5. Kindly turn off lights, air conditioners, and other electrical items when they aren't needed",N/A
1006859,Cute & Cozy Lower East Side 1 bdrm,1280143094,verified,Miranda,Manhattan,Chinatown,40.71344,-73.99037,United States,US,FALSE,flexible,Entire home/apt,2004,0.0,0.0,1,160,2019-06-09,1.33,3,4,1,N/A,N/A
1007411,Beautiful 1br on Upper West Side,18824631834,verified,Alan,Manhattan,Upper West Side,40.80316,-73.96545,United States,US,TRUE,flexible,Entire home/apt,2008,0.0,0.0,5,53,2019-06-22,0.43,4,1,163,"My ideal guests would be warm, friendly, and respectful of sharing my home and it's rhythms. I am allergic to cigarettes, so no smoking please, not even in the yard. A quiet homecoming is much appreciated at the end of the evening's nightlife.",N/A
1007964,Central Manhattan/near Broadway,88136055909,verified,N/A,Manhattan,Hell's Kitchen,40.76076,-73.98867,United States,US,FALSE,strict,Private room,2008,0.0,0.0,2,188,2019-06-23,1.5,4,1,258,"- One of the bedroom closets is not accessible to guests - Please be mindful of the neighbors, quiet time after 10PM  - Check-out time is at 11AM on the day of your departure.  - If you're going to smoke outside, please clean up after yourself and do not throw cigarette butts on the ground - The refrigerator and cabinets are available for your use but please do not take food items unless explicitly permitted",N/A
1008516,"Lovely Room 1, Garden, Best Area, Legal rental",26802410424,verified,Darcy,brookln,South Slope,40.66829,-73.98779,United States,US,TRUE,moderate,Private room,2010,0.0,0.0,4,167,2019-06-24,1.34,4,3,47,N/A,N/A
1009068,Wonderful Guest Bedroom in Manhattan for SINGLES,88920244552,verified,Leonardo,Manhattan,Upper West Side,40.79826,-73.96113,United States,US,FALSE,flexible,Private room,2019,0.0,0.0,2,113,2019-07-05,0.91,3,1,68,N/A,N/A
1009621,West Village Nest - Superhost,46551725984,verified,Daniel,Manhattan,West Village,40.7353,-74.00525,United States,US,TRUE,flexible,Entire home/apt,2018,0.0,0.0,90,27,2018-10-31,0.22,3,1,100,"Arrival time can be no later than 9:00PM unless pre-arranged. No visitors allowed at anytime without prior approval. Overnight guests are not allowed at all. There is no room for guests. Don't ask. No smoking. 11:00 PM is quiet time while watching private room tv is acceptable. No eating meals in the room. It's too small, you'll see what I'm saying, and there's a nice dining table for that. Small snacks are fine. If you cook and/or uses dishes and utensils then please clean them so someone else can use them. Do not leave anything uncleaned in the sink overnight. Shared areas of the home are expected to be maintained after you use them. There are no room services provided other than normal cleaning. Closet and dresser space is provided for your clothes.",N/A
1010173,Only 2 stops to Manhattan studio,62566345680,unconfirmed,Heather,Brooklyn,Williamsburg,40.70837,-73.95352,United States,N/A,N/A,moderate,Entire home/apt,2009,0.0,0.0,2,148,2019-06-29,1.2,3,1,197,"Absolutely no smoking in the building, handling of art work or damaging personal property. All additional charges for movie rental are the responsibility of the renter. Shower before entering the hot tub. No glass or food in the hot tub. Turn off all lights and appliances when leaving the unit.",N/A
1010725,Perfect for Your Parents + Garden,80380130347,verified,Ryan,Brooklyn,Fort Greene,40.69169,-73.97185,United States,N/A,N/A,flexible,Entire home/apt,2006,0.0,0.0,2,198,2019-06-28,1.72,5,1,96,"- Please be mindful of the neighbors, quiet time after 10PM  - Check-out time is at 11AM on the day of your departure.  - If you're going to smoke outside, please clean up after yourself and do not throw cigarette butts on the ground - The refrigerator and cabinets are available for your use but please do not take food items unless explicitly permitted",N/A
1011277,Chelsea Perfect,73862528370,verified,Alberta,manhatan,Chelsea,40.74192,-73.99501,United States,N/A,N/A,moderate,Private room,2008,0.0,0.0,1,260,2019-07-01,2.12,3,1,325,N/A,N/A
1011830,Hip Historic Brownstone Apartment with Backyard,72145018858,N/A,Martin,Brooklyn,Crown Heights,40.67592,-73.94694,United States,N/A,N/A,moderate,Entire home/apt,2004,0.0,0.0,3,53,2019-06-22,4.44,5,1,345,"LAUNDRY - Laundry can be done by the visitor before 10 pm, preferably on weekends. - Please provide your own detergent and fabric conditioner. Keep the machine clean and remember to clean the filter before and after use. - Please ask hosts to teach you how to operate the machines if you are not familiar with it. - Please limit your load and washes as not to overload the machine. - One wash per week will be ideal. HOUSEKEEPING - The bedrooms shall be kept clean and tidy by the visitor. - Please be respectful of others and keep the bathroom clean – do not leave dirty clothes and trash lying around. - Each visitor is responsible for cleaning their own dirty dishes and throwing their own trash in the garbage bin outside. - Please provide your own toiletries such as bath soap, shampoo and toothpaste.  KITCHEN USE  - We are sharing our kitchen and kitchenware stuff. Please make sure to take care of them and make sure you clean, dry and put them back where you found them. If you are cooking, ",N/A
1012382,Huge 2 BR Upper East  Cental Park,79805143117,verified,Audrey,Manhattan,East Harlem,40.79685,-73.94872,United States,N/A,N/A,moderate,Entire home/apt,2013,0.0,0.0,7,0,,0.0,3,2,347,"No smoking, No pets.  No shoes in the house. Visitors are permitted in the common area only. Please use the dining room to enjoy your meals. Also  refrain using an electronic device while having your meal. Quiet time between 10:00pm-6:00am.",N/A
1012934,Sweet and Spacious Brooklyn Loft,86554611512,verified,Alissa,Brooklyn,Williamsburg,40.71842,-73.95718,United States,N/A,N/A,flexible,Entire home/apt,2016,0.0,0.0,3,9,2021-12-28,0.07,3,1,193,"- No smoking or open flames on the property - Please respect the peace and privacy of our neighbors  - Access Roslindale Urban Wild from street - do not jump backyard fence - Max of 3 occupants, please!",N/A
1013487,CBG CtyBGd HelpsHaiti rm#1:1-4,53754237010,verified,Mary,Brooklyn,Park Slope,40.68069,-73.97706,United States,N/A,N/A,moderate,Private room,2013,0.0,0.0,2,130,2019-07-01,1.09,4,6,54,"Arrival time can be no later than 10:00PM. No visitors allowed at anytime without prior approval. Overnight guests are only allowed as part of the reservation. Never more than 2 people in this room.  No smoking. 11:00 PM is quiet time while watching private room tv is acceptable. No eating meals in the room. It's too small, you'll see what I'm saying, and there's a nice dining table for that. Small snacks are fine. If you cook and/or uses dishes and utensils then please clean them so someone else can use them. Do not leave anything uncleaned in the sink overnight. Shared areas of the home are expected to be maintained after you use them. There are no room services provided other than normal cleaning. Closet and dresser space is provided for your clothes.",N/A
1014039,CBG Helps Haiti Room#2.5,87668933180,N/A,William,Brooklyn,Park Slope,40.67989,-73.97798,United States,N/A,N/A,moderate,Private room,2017,0.0,0.0,1,39,2019-01-01,0.37,3,6,9,N/A,N/A
1014591,CBG Helps Haiti Rm #2,57827496420,unconfirmed,Charlotte,Brooklyn,Park Slope,40.68001,-73.97865,United States,N/A,N/A,strict,Private room,2005,0.0,0.0,2,71,2019-07-02,0.61,4,6,344,We take great care of our home and expect you to do the same.  Smoking is not permitted anywhere on the property.,N/A
1015144,"MAISON DES SIRENES1,bohemian apartment",48387947293,N/A,Miranda,Brooklyn,Bedford-Stuyvesant,40.68371,-73.94028,United States,N/A,N/A,strict,Entire home/apt,2006,0.0,0.0,2,88,2019-06-19,0.73,4,2,365,N/A,N/A
1015696,Sunny Bedroom Across Prospect Park,81686279636,N/A,Carlos,Brooklyn,Windsor Terrace,40.65599,-73.97519,United States,N/A,N/A,moderate,Private room,2021,0.0,0.0,1,19,2019-06-23,1.37,5,2,344,"Quiet neighborhood, middle apartment of big house, quiet after 11:00. No smoking or candles in apartment.  Clean kitchen after use.",N/A
1016248,Magnifique Suite au N de Manhattan - vue Cloitres,38811420224,verified,Adrianna,Manhattan,Inwood,40.86754,-73.92639,United States,N/A,N/A,strict,Private room,2017,0.0,0.0,4,0,,0.0,0,1,96,"To treat our home with respect.  No smoking inside but feel free to use the front porch.  The marble in the bathroom is very easily stained. We ask that you limit drinking coffee, red wine, etc to the bedroom.",N/A
1016800,Midtown Pied-a-terre,19382804591,unconfirmed,Andrew,Manhattan,Hell's Kitchen,40.76715,-73.98533,United States,N/A,N/A,moderate,Entire home/apt,2016,0.0,0.0,10,58,2017-08-13,0.49,0,1,103,"Please no pets or smoking in the house, though you can go out on a private porch if you must indulge. Feel free to bring food and cook...I love it when guests prepare a meal.   Quiet hours 9PM to 6AM. ",N/A
1017353,"SPACIOUS, LOVELY FURNISHED MANHATTAN BEDROOM",51449163855,verified,Daryl,Manhattan,Inwood,40.86482,-73.92106,United States,N/A,N/A,strict,Private room,2021,0.0,0.0,3,108,2019-06-15,1.11,0,3,172,"My ideal guests would be warm, friendly, and respectful of sharing my home and it's rhythms. I am allergic to cigarettes, so no smoking please, not even in the yard. A quiet homecoming is much appreciated at the end of the evening's nightlife.",N/A
1017905,Modern 1 BR / NYC / EAST VILLAGE,86424057349,unconfirmed,Tyler,Manhattan,East Village,40.7292,-73.98542,United States,N/A,N/A,flexible,Entire home/apt,2010,0.0,0.0,14,29,2019-04-19,0.24,0,1,56,"Just be respectful, clean, and quiet after 10:00PM!",N/A
1018457,front room/double bed,69410526955,unconfirmed,Byron,Manhattan,Harlem,40.82245,-73.95104,United States,N/A,N/A,flexible,Private room,2004,0.0,0.0,3,242,2019-06-01,2.04,0,3,105,"No loud noises or loud music. Please help us save the planet by shutting off all the lights when they are not needed. Make sure the coffee maker, toaster and other appliance are off when you leave every morning.  No pets. Remove your shoes and keep them inside the apartment. ABSOLUTELY NO SMOKING is allowed in the house. It is only allowed in the rear part of the building. No wild parties, this is a quiet building. All dishes should ne washed after used. All garbage should be taken out and put in the trash cans in the back porch. And last and not least, ENJOY YOUR STAY WITH US!!",N/A
1019010,Spacious 1 bedroom in luxe building,80369762211,verified,Mary,Manhattan,Harlem,40.81305,-73.95466,United States,N/A,N/A,flexible,Private room,2007,0.0,0.0,2,88,2019-06-14,1.42,0,1,169,N/A,N/A
1019562,Loft in Williamsburg Area w/ Roof,50968902783,unconfirmed,John,Brooklyn,Greenpoint,40.72219,-73.93762,United States,N/A,N/A,moderate,Private room,2007,0.0,0.0,4,197,2019-06-15,1.65,0,3,365,"LAUNDRY - Laundry can be done by the visitor before 10 pm, preferably on weekends. - Please provide your own detergent and fabric conditioner. Keep the machine clean and remember to clean the filter before and after use. - Please ask hosts to teach you how to operate the machines if you are not familiar with it. - Please limit your load and washes as not to overload the machine. - One wash per week will be ideal. HOUSEKEEPING - The bedrooms shall be kept clean and tidy by the visitor. - Please be respectful of others and keep the bathroom clean – do not leave dirty clothes and trash lying around. - Each visitor is responsible for cleaning their own dirty dishes and throwing their own trash in the garbage bin outside. - Please provide your own toiletries such as bath soap, shampoo and toothpaste.  KITCHEN USE  - We are sharing our kitchen and kitchenware stuff. Please make sure to take care of them and make sure you clean, dry and put them back where you found them. If you are cooking, ",N/A
1020114,back room/bunk beds,25066620900,verified,Alfred,Manhattan,Harlem,40.8213,-73.95318,United States,N/A,N/A,strict,Private room,2021,0.0,0.0,3,273,2019-07-01,2.37,0,3,365,Please no smoking on the property,N/A
1020667,Large B&B Style rooms,57938703679,unconfirmed,Jared,Brooklyn,Bedford-Stuyvesant,40.6831,-73.95473,United States,US,TRUE,strict,Private room,2016,0.0,0.0,1,74,2019-05-12,0.66,0,2,76,"No smoking, this is non-negotiable.  No illegal drug use and we make no exceptions.  We do not allow additional guests or parties.  We expect respectful behavior, particularly late at night. We can allow friendly, house- trained dogs.  We have a dog of our own, so its important that your dog be under your charge at all times.  You may not leave your dog in the apartment alone.  You will be responsible for any damage pets may incur, including paying for cleaning of carpets should they be soiled.",N/A
1021219,"Lovely room 2 & garden; Best area, Legal rental",53343148512,verified,Brad,Brooklyn,South Slope,40.66869,-73.9878,United States,US,TRUE,moderate,Private room,2003,0.0,0.0,4,168,2019-06-21,1.41,0,3,365,N/A,N/A
1021771,Clean and Quiet in Brooklyn,26207748876,verified,Arthur,Brooklyn,Bedford-Stuyvesant,40.68876,-73.94312,United States,US,FALSE,moderate,Private room,2004,0.0,0.0,60,0,,0.0,0,1,294,NO Shoes in the house. This is why my house is so clean!  NO Smoking inside or outside (cigarettes or anything else).  NO Parties (inside or outside). NO pets (inside or out)  This is a nice quiet neighborhood. Please be respectful of others.,N/A
1022323,Cute apt in artist's home,88653822946,verified,Joyce,Brooklyn,Bushwick,40.70186,-73.92745,United States,US,TRUE,moderate,Entire home/apt,2005,0.0,0.0,2,231,2019-06-22,1.96,3,2,214,"Please no shoes inside the house and no  smoking (cigarettes or anything else) either in or outside. Please be respectful of neighbors in the evening and early morning (10pm-7am). When you leave at the end of your stay, please take your trash outside to the large garbage bin at the end of the driveway.",N/A
1022876,Country space in the city,49725315867,verified,Deanna,Brooklyn,Flatbush,40.63702,-73.96327,United States,US,TRUE,strict,Private room,2011,0.0,0.0,1,0,,0.0,3,1,356,"House Guidelines for our BnB We are delighted to welcome you.  Check in Sun – Thurs by 8PM and Fri, Sat by 9pm. Please bear in mind that this is not a hotel but our home and we are opening it to you.  We will do our utmost to make your stay enjoyable and fun.  We ask that you take care to respect our home and its appearance.  Thank you.  Marilyn and Alan 1.ROOMS - The bedroom is yours for the duration of your stay.  Be sure to let us know if you need something.  Please keep it neat and tidy and take advantage of the closet and bureau for your belongings.  We do ask that you turn off lights, air conditioner, fan, etc. when you are not in the room. Thank you. 2.LIGHTS – Please, too, remember to turn off lights on the stairway when returning.   3.KEYS - 2 house keys are provided - Replacement cost is $15 each 4.PARKING – Parking is available on street at all times.   (website hidden) – When the weather is inclement please remove shoes.   6.TOILETRIES - If you need them we can provide basi",N/A
1023428,LowerEastSide apt share shortterm 1,31736204344,N/A,Clark,Manhattan,Lower East Side,40.71401,-73.98917,United States,US,TRUE,moderate,Shared room,2012,0.0,0.0,1,214,2019-07-05,1.81,5,4,110,"Not smoking, drugs, or alcoholics allow. Guest most inform the purpose of their trip and provide ID or passport upon arrival. Only 1 gust allow unless the guest consult the host first for any other type of arrangements.",N/A
1023980,ENJOY Downtown NYC!,63131487263,unconfirmed,Byron,Manhattan,East Village,40.7229,-73.98199,United States,US,FALSE,strict,Private room,2005,0.0,0.0,2,245,2019-06-21,2.08,3,2,354,N/A,N/A
1024533,Beautiful Sunny Park Slope Brooklyn,50357575975,verified,Alina,Brooklyn,South Slope,40.66278,-73.97966,United States,US,TRUE,flexible,Entire home/apt,2020,0.0,0.0,3,15,2019-05-27,0.39,2,1,33,"No smoking inside. Since I have a dog, there are no other pets allowed.",N/A
1025085,1bdr w private bath. in lofty apt,45597582469,N/A,Charlie,Brooklyn,Fort Greene,40.69673,-73.97584,United States,US,FALSE,strict,Private room,2008,0.0,0.0,7,25,2018-09-30,0.23,1,1,365,"No smoking, No pets. No shoes in the house. Visitors are permitted in the common area only. Please use the dining room to enjoy your meals. Also please refrain using an electronic device while having your meal. Quiet time between 10:00pm-6:00am.",N/A
1025637,West Side Retreat,55430108992,unconfirmed,Alford,Manhattan,Upper West Side,40.79009,-73.97927,United States,US,FALSE,strict,Private room,2017,0.0,0.0,4,81,2019-06-16,0.69,3,1,86,"Free WiFi! * No smoking anywhere on property. *No out-door shoes to be worn in the house. We ask that guests be willing to be considerate and quiet while coming and going from 10 pm to 6 am, please. This is a non-smoking property. There is no smoking anywhere on the property, inside nor on the porch. We also ask guests to bring inside shoes/slippers. Thank you. As this is our home, we request you not to move the furniture nor our belongings around and to treat our home as you would wish your home to be treated. Thank you.",N/A
1026190,BEST BET IN HARLEM,2107606817,unconfirmed,Chester,Manhattan,Harlem,40.81175,-73.94478,United States,US,TRUE,flexible,Entire home/apt,2006,0.0,0.0,7,97,2019-06-13,0.84,0,1,152,- Quiet hours between 10pm-6am - Visitors in common spaces only,N/A
1026742,Entire apartment in central Brooklyn neighborhood.,41615406010,N/A,David,Brooklyn,Prospect-Lefferts Gardens,40.65944,-73.96238,United States,US,FALSE,strict,Entire home/apt,2007,0.0,0.0,0,11,2019-06-05,0.49,0,1,353,N/A,N/A
1027294,"1 Stop fr. Manhattan! Private Suite,Landmark Block",81253735818,unconfirmed,Victoria,Queens,Long Island City,40.74771,-73.9474,United States,US,TRUE,flexible,Private room,2022,0.0,0.0,0,248,2019-07-01,2.25,0,1,26,"The room is strictly non-smoking, however, you can smoke in the back porch. No drugs! No visitors without previous authorization. We do prefer adults since the house is not ""child proof"" and, we are full time workers. Babies OK!  Please, keep in mind that, this is not a hotel.  The room should be left in good condition and picked up when you leave.  Longer term renters use of kitchen and other facilities can be arranged.",N/A
1027846,Charming Brownstone 3 - Near PRATT,42134614458,verified,Jared,Brooklyn,Bedford-Stuyvesant,40.68111,-73.95591,United States,US,TRUE,moderate,Entire home/apt,2019,0.0,0.0,0,61,2019-05-25,0.52,0,1,32,"No smoking, please. No drugs or guns allowed.  Only registered guests allowed; no other visitors please.  We cannot accommodate pets as I already have two. Cat:  OK to let Bella out of the house.  Dog:  Please don't let Moe out of the house. He'd like to run to the street. He is also a bit noisy when visitors arrive. Please say hi and then ignore him and he'll calm down.  No candles or incense burning.  Kitchen:  you are welcome to use kitchen and appliances between 7a and 9p, except no stove use for cooking meals please.",N/A
1028399,bright and stylish duplex,53466382920,verified,Chloe,Brooklyn,Bedford-Stuyvesant,40.68554,-73.9409,United States,US,FALSE,moderate,Entire home/apt,2015,0.0,0.0,0,11,2017-01-01,0.1,1,1,85,No smoking. No pet. No shoes in the house. Visitors are permitted in the common area only. Please use the dining room to enjoy your meals. Also please refrain using an electronic device while having your meal. Quiet time between 10:00pm-6:00am.,N/A
1028951,Fort Greene brownstone,49393946881,unconfirmed,Abraham,Brooklyn,Fort Greene,40.69142,-73.97376,United States,US,TRUE,strict,Private room,2009,0.0,0.0,0,135,2019-06-17,1.16,1,2,0,"We limit number of guests not staying, so please keep it to a maximum of 2 additional visitors within normal social hours (noon-11pm). We are respectful of others, and expect the same from our guests. Have fun and come and go as you please. We promise to do the same.",N/A
1029503,Blue Room for 2 in Brownstone for $1350 monthly,1529890895,unconfirmed,Sophia,Brooklyn,Bedford-Stuyvesant,40.68043,-73.93934,United States,US,FALSE,moderate,Private room,2015,0.0,0.0,0,112,2019-06-16,1.01,2,3,0,"We regret we cannot accommodate pets.  Strictly no smoking anywhere on the property. Not inside. Not in the yard. Not on the deck or driveway. Like many New England houses, our house is constructed entirely of wood. No smoking please. ",N/A
